{
  "skill_id": "SK-001",
  "skill_name": "示例：核心概念入口",
  "source": {
    "textbook": "替换为资料来源",
    "chapter": "替换为章节",
    "section": "替换为小节或段落锚点"
  },
  "entries": [
    {
      "id": "SK-001-Q01",
      "coverage": "core",
      "family": "definition",
      "question_type": "conceptual",
      "recommended_format": "short_answer",
      "prompt": "用自己的话说明这个技能点的核心概念是什么，并指出它解决了什么问题。",
      "source_sections": [
        "替换为具体资料锚点"
      ],
      "expected_points": [
        "说出核心概念的正面定义",
        "说明它要区分或解决的问题",
        "避免只复述术语名"
      ],
      "related_skills": [],
      "difficulty": "low",
      "stage_fit": [
        "demo_worked",
        "practice",
        "review"
      ],
      "rubric_id": "SK-001-R01",
      "notes": "复制后替换成真实题目。"
    },
    {
      "id": "SK-001-Q02",
      "coverage": "misconception",
      "family": "misread",
      "question_type": "argument_analysis",
      "recommended_format": "short_argument",
      "prompt": "有人把这个概念理解成一个相近但错误的说法。请指出错误在哪里，并给出修正表述。",
      "source_sections": [
        "替换为具体资料锚点"
      ],
      "expected_points": [
        "识别错误说法中的关键偏差",
        "说明偏差为什么会影响理解",
        "给出更准确的表述"
      ],
      "related_skills": [],
      "difficulty": "medium",
      "stage_fit": [
        "demo_worked",
        "practice",
        "review"
      ],
      "rubric_id": "SK-001-R02"
    },
    {
      "id": "SK-001-Q03",
      "coverage": "boundary",
      "family": "boundary",
      "question_type": "boundary",
      "recommended_format": "multiple_choice_explained",
      "prompt": "下面哪一种情况真正属于这个概念的适用范围？选择后用一句话说明理由。A. 替换为干扰项一 B. 替换为正确项 C. 替换为干扰项二 D. 替换为边界项",
      "source_sections": [
        "替换为具体资料锚点"
      ],
      "expected_points": [
        "选出正确适用情境",
        "解释适用边界",
        "排除至少一个干扰项"
      ],
      "related_skills": [],
      "difficulty": "medium",
      "stage_fit": [
        "demo_faded",
        "practice",
        "review"
      ],
      "rubric_id": "SK-001-R06"
    },
    {
      "id": "SK-001-Q04",
      "coverage": "transfer",
      "family": "scenario",
      "question_type": "scenario",
      "recommended_format": "short_answer",
      "prompt": "给出一个新情境，判断是否可以用这个概念分析，并说明你会如何分析。",
      "source_sections": [
        "替换为具体资料锚点"
      ],
      "expected_points": [
        "识别新情境中的相关结构",
        "把概念迁移到新情境",
        "说明迁移限制"
      ],
      "related_skills": [],
      "difficulty": "medium",
      "stage_fit": [
        "demo_faded",
        "practice",
        "review"
      ],
      "rubric_id": "SK-001-R04"
    },
    {
      "id": "SK-001-Q05",
      "coverage": "core",
      "family": "counterexample",
      "question_type": "counterexample",
      "recommended_format": "counterexample",
      "prompt": "构造一个反例，说明如果忽略这个概念的关键条件，会导致怎样的错误判断。",
      "source_sections": [
        "替换为具体资料锚点"
      ],
      "expected_points": [
        "给出具体反例",
        "指出反例破坏了哪个条件",
        "说明错误判断如何产生"
      ],
      "related_skills": [],
      "difficulty": "high",
      "stage_fit": [
        "demo_independent",
        "practice",
        "review"
      ],
      "rubric_id": "SK-001-R03"
    },
    {
      "id": "SK-001-Q06",
      "coverage": "transfer",
      "family": "compare",
      "question_type": "conceptual",
      "recommended_format": "short_answer",
      "prompt": "把这个概念和一个容易混淆的概念作对比，列出一个共同点和两个差异点。",
      "source_sections": [
        "替换为具体资料锚点"
      ],
      "expected_points": [
        "说明共同点",
        "给出两个实质差异",
        "避免只做词面比较"
      ],
      "related_skills": [],
      "difficulty": "medium",
      "stage_fit": [
        "demo_independent",
        "practice",
        "review"
      ],
      "rubric_id": "SK-001-R02"
    },
    {
      "id": "SK-001-Q07",
      "coverage": "core",
      "family": "diagnostic_mc",
      "question_type": "conceptual",
      "recommended_format": "multiple_choice_explained",
      "prompt": "下面哪一个说法最接近这个核心概念？选择后用一句话说明为什么其他说法不够准确。A. 替换为过宽说法 B. 替换为正确说法 C. 替换为过窄说法 D. 替换为无关说法",
      "source_sections": [
        "替换为具体资料锚点"
      ],
      "expected_points": [
        "选出最准确表述",
        "解释至少一个干扰项的问题",
        "把判断依据落到核心定义上"
      ],
      "related_skills": [],
      "difficulty": "medium",
      "stage_fit": [
        "demo_independent",
        "practice",
        "review"
      ],
      "rubric_id": "SK-001-R05"
    },
    {
      "id": "SK-001-Q08",
      "coverage": "transfer",
      "family": "scenario_variant",
      "question_type": "scenario",
      "recommended_format": "short_answer",
      "prompt": "换一个实际案例，说明这个概念如何帮助你判断案例中的关键差异。",
      "source_sections": [
        "替换为具体资料锚点"
      ],
      "expected_points": [
        "描述案例中的关键差异",
        "把差异连接到核心概念",
        "说明判断步骤"
      ],
      "related_skills": [],
      "difficulty": "medium",
      "stage_fit": [
        "practice",
        "review"
      ],
      "rubric_id": "SK-001-R04"
    },
    {
      "id": "SK-001-Q09",
      "coverage": "misconception",
      "family": "argument_variant",
      "question_type": "argument_analysis",
      "recommended_format": "short_argument",
      "prompt": "分析一个错误推理：它从一个看似合理的前提出发，却把这个概念用错了。请指出错误步骤。",
      "source_sections": [
        "替换为具体资料锚点"
      ],
      "expected_points": [
        "定位错误推理步骤",
        "说明概念被误用的方式",
        "给出修正后的推理方向"
      ],
      "related_skills": [],
      "difficulty": "medium",
      "stage_fit": [
        "demo_independent",
        "practice",
        "review"
      ],
      "rubric_id": "SK-001-R02"
    },
    {
      "id": "SK-001-Q10",
      "coverage": "boundary",
      "family": "boundary_mc",
      "question_type": "boundary",
      "recommended_format": "short_argument",
      "prompt": "判断一个边界案例为什么不是典型案例，并说明它仍然与这个概念有关的理由。",
      "source_sections": [
        "替换为具体资料锚点"
      ],
      "expected_points": [
        "识别边界案例",
        "说明它接近适用条件的哪一侧",
        "区分典型案例、反例和边界案例"
      ],
      "related_skills": [],
      "difficulty": "high",
      "stage_fit": [
        "practice",
        "review"
      ],
      "rubric_id": "SK-001-R07"
    },
    {
      "id": "SK-001-Q11",
      "coverage": "core",
      "family": "definition_variant",
      "question_type": "conceptual",
      "recommended_format": "short_answer",
      "prompt": "把这个技能点压缩成一句可检查的定义，并列出定义中不可省略的一个条件。",
      "source_sections": [
        "替换为具体资料锚点"
      ],
      "expected_points": [
        "给出简明定义",
        "列出不可省略条件",
        "说明条件省略后的风险"
      ],
      "related_skills": [],
      "difficulty": "medium",
      "stage_fit": [
        "practice",
        "review"
      ],
      "rubric_id": "SK-001-R01"
    },
    {
      "id": "SK-001-Q12",
      "coverage": "misconception",
      "family": "false_friend",
      "question_type": "scenario",
      "recommended_format": "short_answer",
      "prompt": "给出一个容易误判的场景，说明学习者为什么可能把它误认为这个概念的例子。",
      "source_sections": [
        "替换为具体资料锚点"
      ],
      "expected_points": [
        "描述误判场景",
        "指出误判诱因",
        "说明正确判断"
      ],
      "related_skills": [],
      "difficulty": "medium",
      "stage_fit": [
        "practice",
        "review"
      ],
      "rubric_id": "SK-001-R04"
    },
    {
      "id": "SK-001-Q13",
      "coverage": "boundary",
      "family": "edge_case",
      "question_type": "argument_analysis",
      "recommended_format": "short_argument",
      "prompt": "分析一个边界判断：为什么它不能被简单归为适用或不适用？",
      "source_sections": [
        "替换为具体资料锚点"
      ],
      "expected_points": [
        "指出边界判断的两侧理由",
        "说明最终判断依据",
        "避免把边界问题简化成二分"
      ],
      "related_skills": [],
      "difficulty": "high",
      "stage_fit": [
        "practice",
        "review"
      ],
      "rubric_id": "SK-001-R07"
    },
    {
      "id": "SK-001-Q14",
      "coverage": "transfer",
      "family": "negative_transfer",
      "question_type": "counterexample",
      "recommended_format": "counterexample",
      "prompt": "构造一个迁移失败的反例，说明这个概念在什么条件下不能直接套用。",
      "source_sections": [
        "替换为具体资料锚点"
      ],
      "expected_points": [
        "给出迁移失败场景",
        "指出不能套用的条件",
        "说明应该退回哪一个判断步骤"
      ],
      "related_skills": [],
      "difficulty": "high",
      "stage_fit": [
        "practice",
        "review"
      ],
      "rubric_id": "SK-001-R06"
    }
  ]
}
